{
  "schemaVersion": "1.0.0-draft",
  "mediaType": "application/vnd.agentsuite.build-profile.v1+json",
  "id": "default",
  "runtimeBase": [
    {
      "platform": {
        "os": "linux",
        "architecture": "amd64"
      },
      "image": {
        "mediaType": "application/vnd.oci.image.manifest.v1+json",
        "digest": "sha256:aaaaaaaaaaaaaaaaaaaaaaaaaaaaaaaaaaaaaaaaaaaaaaaaaaaaaaaaaaaaaaaa",
        "size": 1
      }
    }
  ],
  "harness": [
    {
      "platform": {
        "os": "linux",
        "architecture": "amd64"
      },
      "image": {
        "mediaType": "application/vnd.oci.image.manifest.v1+json",
        "digest": "sha256:aaaaaaaaaaaaaaaaaaaaaaaaaaaaaaaaaaaaaaaaaaaaaaaaaaaaaaaaaaaaaaaa",
        "size": 1
      }
    }
  ],
  "sourceEpoch": 1
}
